{
  "job_title": "Power Electronics Engineer",
  "company_info": {
    "name": "Generic Electronics Corporation",
    "industry": "Semiconductors & Electronics Manufacturing",
    "description": "A pioneering engineering firm specializing in advanced electronic design and systems."
  },
  "location": {
    "city": "Bengaluru",
    "state": "Karnataka",
    "country": "India",
    "is_remote": false,
    "remote_type": "On-site"
  },
  "employment_type": "Full-time",
  "experience_required": {
    "min_years": 2,
    "max_years": 5
  },
  "responsibilities": [
    "Design power conversion circuits (AC-DC, DC-DC, DC-AC)",
    "Develop switching power supplies and converters",
    "Work with power semiconductors (MOSFET, IGBT, SiC, GaN)",
    "Improve efficiency, thermal performance, and reliability",
    "Perform simulation and hardware testing"
  ],
  "mandatory_skills": [
    {
      "name": "Power & EV Electronics",
      "level": "Intermediate",
      "years_of_experience": 2
    },
    {
      "name": "MATLAB / Simulink",
      "level": "Intermediate",
      "years_of_experience": 2
    },
    {
      "name": "Electrical machines basics",
      "level": "Intermediate",
      "years_of_experience": 2
    },
    {
      "name": "Thermal and efficiency analysis",
      "level": "Intermediate",
      "years_of_experience": 2
    }
  ],
  "preferred_skills": [],
  "education_requirements": [
    "Bachelor's degree in Electronics Engineering, Electrical Engineering, Computer Science, or a related technical field."
  ],
  "salary_range": {
    "min": 65000,
    "max": 95000,
    "currency": "USD",
    "period": "Yearly"
  },
  "benefits": [
    "Health Insurance",
    "Paid Time Off (PTO)",
    "Professional Development Assistance",
    "Performance Bonus"
  ]
}