{
  "job_title": "ASIC Design Engineer",
  "company_info": {
    "name": "Generic Electronics Corporation",
    "industry": "Semiconductors & Electronics Manufacturing",
    "description": "A pioneering engineering firm specializing in advanced electronic design and systems."
  },
  "location": {
    "city": "Bengaluru",
    "state": "Karnataka",
    "country": "India",
    "is_remote": false,
    "remote_type": "On-site"
  },
  "employment_type": "Full-time",
  "experience_required": {
    "min_years": 2,
    "max_years": 5
  },
  "responsibilities": [
    "Develop ASIC architecture and RTL design",
    "Work on low-power and high-performance chip design",
    "Optimize chip functionality for specific applications",
    "Perform design synthesis and simulation",
    "Ensure manufacturability and reliability"
  ],
  "mandatory_skills": [
    {
      "name": "Digital Electronics",
      "level": "Intermediate",
      "years_of_experience": 2
    },
    {
      "name": "VLSI & IC Design",
      "level": "Intermediate",
      "years_of_experience": 2
    },
    {
      "name": "Hardware description languages",
      "level": "Intermediate",
      "years_of_experience": 2
    },
    {
      "name": "Timing and power optimization",
      "level": "Intermediate",
      "years_of_experience": 2
    }
  ],
  "preferred_skills": [],
  "education_requirements": [
    "Bachelor's degree in Electronics Engineering, Electrical Engineering, Computer Science, or a related technical field."
  ],
  "salary_range": {
    "min": 65000,
    "max": 95000,
    "currency": "USD",
    "period": "Yearly"
  },
  "benefits": [
    "Health Insurance",
    "Paid Time Off (PTO)",
    "Professional Development Assistance",
    "Performance Bonus"
  ]
}