{
  "job_title": "EV Powertrain Electronics Engineer",
  "company_info": {
    "name": "Generic Electronics Corporation",
    "industry": "Semiconductors & Electronics Manufacturing",
    "description": "A pioneering engineering firm specializing in advanced electronic design and systems."
  },
  "location": {
    "city": "Bengaluru",
    "state": "Karnataka",
    "country": "India",
    "is_remote": false,
    "remote_type": "On-site"
  },
  "employment_type": "Full-time",
  "experience_required": {
    "min_years": 2,
    "max_years": 5
  },
  "responsibilities": [
    "Develop EV motor control systems",
    "Design power electronics for drivetrain",
    "Work on regenerative braking systems",
    "Optimize energy efficiency and performance",
    "Integrate battery and motor systems"
  ],
  "mandatory_skills": [
    {
      "name": "Power & EV Electronics",
      "level": "Intermediate",
      "years_of_experience": 2
    },
    {
      "name": "Control Systems",
      "level": "Intermediate",
      "years_of_experience": 2
    },
    {
      "name": "Embedded systems knowledge",
      "level": "Intermediate",
      "years_of_experience": 2
    },
    {
      "name": "Automotive electronics standards",
      "level": "Intermediate",
      "years_of_experience": 2
    }
  ],
  "preferred_skills": [],
  "education_requirements": [
    "Bachelor's degree in Electronics Engineering, Electrical Engineering, Computer Science, or a related technical field."
  ],
  "salary_range": {
    "min": 65000,
    "max": 95000,
    "currency": "USD",
    "period": "Yearly"
  },
  "benefits": [
    "Health Insurance",
    "Paid Time Off (PTO)",
    "Professional Development Assistance",
    "Performance Bonus"
  ]
}