{
  "job_title": "Graduate Engineer Trainee (GET – Electronics)",
  "company_info": {
    "name": "Generic Electronics Corporation",
    "industry": "Semiconductors & Electronics Manufacturing",
    "description": "A pioneering engineering firm specializing in advanced electronic design and systems."
  },
  "location": {
    "city": "Bengaluru",
    "state": "Karnataka",
    "country": "India",
    "is_remote": false,
    "remote_type": "On-site"
  },
  "employment_type": "Full-time",
  "experience_required": {
    "min_years": 0,
    "max_years": 1
  },
  "responsibilities": [
    "Undergo training in electronics design and manufacturing",
    "Learn company products and systems",
    "Assist in production and R&D departments",
    "Work on mini-projects and assessments",
    "Rotate across departments (design, testing, production)"
  ],
  "mandatory_skills": [
    {
      "name": "Strong fundamentals in electronics engineering",
      "level": "Beginner",
      "years_of_experience": 0
    },
    {
      "name": "Problem-solving ability",
      "level": "Beginner",
      "years_of_experience": 0
    }
  ],
  "preferred_skills": [
    {
      "name": "Embedded C/C++",
      "level": "Beginner"
    }
  ],
  "education_requirements": [
    "Bachelor of Engineering (B.E.) or Bachelor of Technology (B.Tech.) in Electronics & Communication, Electrical Engineering, or related discipline."
  ],
  "salary_range": {
    "min": 35000,
    "max": 55000,
    "currency": "USD",
    "period": "Yearly"
  },
  "benefits": [
    "Health Insurance",
    "Paid Time Off (PTO)",
    "Professional Development Assistance",
    "Mentorship & Training Programs"
  ]
}