{
  "job_title": "Assembly Line Engineer",
  "company_info": {
    "name": "Generic Electronics Corporation",
    "industry": "Semiconductors & Electronics Manufacturing",
    "description": "A pioneering engineering firm specializing in advanced electronic design and systems."
  },
  "location": {
    "city": "Bengaluru",
    "state": "Karnataka",
    "country": "India",
    "is_remote": false,
    "remote_type": "On-site"
  },
  "employment_type": "Full-time",
  "experience_required": {
    "min_years": 2,
    "max_years": 5
  },
  "responsibilities": [
    "Set up and manage assembly line operations",
    "Ensure smooth workflow between stations",
    "Monitor productivity and output quality",
    "Reduce assembly errors and delays",
    "Train operators on assembly procedures"
  ],
  "mandatory_skills": [
    {
      "name": "Production line management",
      "level": "Intermediate",
      "years_of_experience": 2
    },
    {
      "name": "Electronics assembly knowledge",
      "level": "Intermediate",
      "years_of_experience": 2
    },
    {
      "name": "Workflow optimization",
      "level": "Intermediate",
      "years_of_experience": 2
    },
    {
      "name": "Hardware Testing & Troubleshooting",
      "level": "Intermediate",
      "years_of_experience": 2
    }
  ],
  "preferred_skills": [],
  "education_requirements": [
    "Bachelor's degree in Electronics Engineering, Electrical Engineering, Computer Science, or a related technical field."
  ],
  "salary_range": {
    "min": 65000,
    "max": 95000,
    "currency": "USD",
    "period": "Yearly"
  },
  "benefits": [
    "Health Insurance",
    "Paid Time Off (PTO)",
    "Professional Development Assistance",
    "Performance Bonus"
  ]
}