{
  "job_title": "ISRO Scientist Engineer (Electronics)",
  "company_info": {
    "name": "Generic Electronics Corporation",
    "industry": "Semiconductors & Electronics Manufacturing",
    "description": "A pioneering engineering firm specializing in advanced electronic design and systems."
  },
  "location": {
    "city": "Bengaluru",
    "state": "Karnataka",
    "country": "India",
    "is_remote": false,
    "remote_type": "On-site"
  },
  "employment_type": "Full-time",
  "experience_required": {
    "min_years": 5,
    "max_years": 10
  },
  "responsibilities": [
    "Design satellite communication systems",
    "Develop onboard electronic systems for spacecraft",
    "Work on telemetry, tracking, and control systems",
    "Ensure reliability in space environments",
    "Support mission-critical electronics systems"
  ],
  "mandatory_skills": [
    {
      "name": "Space Electronics",
      "level": "Advanced",
      "years_of_experience": 5
    },
    {
      "name": "Embedded systems",
      "level": "Advanced",
      "years_of_experience": 5
    },
    {
      "name": "Control Systems",
      "level": "Advanced",
      "years_of_experience": 5
    },
    {
      "name": "High-reliability electronics design",
      "level": "Advanced",
      "years_of_experience": 5
    }
  ],
  "preferred_skills": [],
  "education_requirements": [
    "Master's or Ph.D. in Electronics Engineering, Physics, or a closely related quantitative field."
  ],
  "salary_range": {
    "min": 100000,
    "max": 140000,
    "currency": "USD",
    "period": "Yearly"
  },
  "benefits": [
    "Health Insurance",
    "Paid Time Off (PTO)",
    "Professional Development Assistance",
    "Performance Bonus",
    "Retirement Matching (401k)"
  ]
}