{
  "job_title": "Service Engineer (Electronics Equipment)",
  "company_info": {
    "name": "Generic Electronics Corporation",
    "industry": "Semiconductors & Electronics Manufacturing",
    "description": "A pioneering engineering firm specializing in advanced electronic design and systems."
  },
  "location": {
    "city": "Bengaluru",
    "state": "Karnataka",
    "country": "India",
    "is_remote": false,
    "remote_type": "On-site"
  },
  "employment_type": "Full-time",
  "experience_required": {
    "min_years": 2,
    "max_years": 5
  },
  "responsibilities": [
    "Install electronic devices and systems",
    "Perform repair and maintenance",
    "Provide customer technical support",
    "Diagnose hardware issues on-site",
    "Maintain service reports"
  ],
  "mandatory_skills": [
    {
      "name": "Hardware Testing & Troubleshooting",
      "level": "Intermediate",
      "years_of_experience": 2
    },
    {
      "name": "Field service experience",
      "level": "Intermediate",
      "years_of_experience": 2
    },
    {
      "name": "Communication skills",
      "level": "Intermediate",
      "years_of_experience": 2
    }
  ],
  "preferred_skills": [],
  "education_requirements": [
    "Bachelor's degree in Electronics Engineering, Electrical Engineering, Computer Science, or a related technical field."
  ],
  "salary_range": {
    "min": 65000,
    "max": 95000,
    "currency": "USD",
    "period": "Yearly"
  },
  "benefits": [
    "Health Insurance",
    "Paid Time Off (PTO)",
    "Professional Development Assistance",
    "Performance Bonus"
  ]
}