{
  "job_title": "Lean Manufacturing Engineer (Electronics)",
  "company_info": {
    "name": "Generic Electronics Corporation",
    "industry": "Semiconductors & Electronics Manufacturing",
    "description": "A pioneering engineering firm specializing in advanced electronic design and systems."
  },
  "location": {
    "city": "Bengaluru",
    "state": "Karnataka",
    "country": "India",
    "is_remote": false,
    "remote_type": "On-site"
  },
  "employment_type": "Full-time",
  "experience_required": {
    "min_years": 2,
    "max_years": 5
  },
  "responsibilities": [
    "Implement lean manufacturing techniques (5S, Kaizen, Six Sigma)",
    "Reduce production waste and inefficiency",
    "Improve cycle time and productivity",
    "Analyze manufacturing processes",
    "Train staff on lean principles"
  ],
  "mandatory_skills": [
    {
      "name": "Lean manufacturing methodologies",
      "level": "Intermediate",
      "years_of_experience": 2
    },
    {
      "name": "Data analysis and process optimization",
      "level": "Intermediate",
      "years_of_experience": 2
    },
    {
      "name": "Quality improvement tools",
      "level": "Intermediate",
      "years_of_experience": 2
    },
    {
      "name": "Industrial engineering basics",
      "level": "Intermediate",
      "years_of_experience": 2
    }
  ],
  "preferred_skills": [],
  "education_requirements": [
    "Bachelor's degree in Electronics Engineering, Electrical Engineering, Computer Science, or a related technical field."
  ],
  "salary_range": {
    "min": 65000,
    "max": 95000,
    "currency": "USD",
    "period": "Yearly"
  },
  "benefits": [
    "Health Insurance",
    "Paid Time Off (PTO)",
    "Professional Development Assistance",
    "Performance Bonus"
  ]
}