{
  "job_title": "Electronics Production Engineer",
  "company_info": {
    "name": "Generic Electronics Corporation",
    "industry": "Semiconductors & Electronics Manufacturing",
    "description": "A pioneering engineering firm specializing in advanced electronic design and systems."
  },
  "location": {
    "city": "Bengaluru",
    "state": "Karnataka",
    "country": "India",
    "is_remote": false,
    "remote_type": "On-site"
  },
  "employment_type": "Full-time",
  "experience_required": {
    "min_years": 2,
    "max_years": 5
  },
  "responsibilities": [
    "Supervise electronic product assembly and production lines",
    "Ensure production targets and efficiency goals are met",
    "Troubleshoot production issues and downtime",
    "Coordinate with design, quality, and supply chain teams",
    "Monitor machine and operator performance"
  ],
  "mandatory_skills": [
    {
      "name": "Electronics manufacturing basics",
      "level": "Intermediate",
      "years_of_experience": 2
    },
    {
      "name": "Production planning knowledge",
      "level": "Intermediate",
      "years_of_experience": 2
    },
    {
      "name": "Problem-solving skills",
      "level": "Intermediate",
      "years_of_experience": 2
    },
    {
      "name": "Industrial process understanding",
      "level": "Intermediate",
      "years_of_experience": 2
    }
  ],
  "preferred_skills": [],
  "education_requirements": [
    "Bachelor's degree in Electronics Engineering, Electrical Engineering, Computer Science, or a related technical field."
  ],
  "salary_range": {
    "min": 65000,
    "max": 95000,
    "currency": "USD",
    "period": "Yearly"
  },
  "benefits": [
    "Health Insurance",
    "Paid Time Off (PTO)",
    "Professional Development Assistance",
    "Performance Bonus"
  ]
}